{"coverage_complete":true,"locked_at":"2026-07-23T00:53:00+08:00","required_artifacts":["promax-dossier.md","promax-concept-atlas.md","promax-case-and-countercase.md","promax-essay.md"],"run_id":"promax-green-v3-gpt-5-6-sol-a1-f2bde4ebcefa435fbf4be12cf278730b","schema_id":"crossframe.promax.v8.output-plan","schema_version":1,"sections":[{"artifact_paths":["promax-dossier.md","promax-concept-atlas.md","promax-essay.md"],"claim_ids":["CLAIM-REMOTE-TRUST-UNIVERSAL"],"concept_ids":["V8-CANON-EVIDENCE-CONTRACT","V8-CANON-APP-ORG"],"counterexample_ids":[],"example_ids":[],"judgment_ids":[],"section_id":"SECTION-BOUNDARY","title":"问题、证据与组织边界"},{"artifact_paths":["promax-dossier.md","promax-concept-atlas.md","promax-essay.md"],"claim_ids":[],"concept_ids":["V8-CANON-D0-SP","V8-CANON-D3","V8-CANON-E5"],"counterexample_ids":[],"example_ids":[],"judgment_ids":[],"section_id":"SECTION-SCALE","title":"尺度剖面与迁移检验"},{"artifact_paths":["promax-dossier.md","promax-concept-atlas.md","promax-case-and-countercase.md","promax-essay.md"],"claim_ids":[],"concept_ids":["V8-CANON-U07"],"counterexample_ids":["CASE-GOV-FAILURE"],"example_ids":["CASE-GOV-REAL","CASE-GOV-CONDITIONAL"],"judgment_ids":[],"section_id":"SECTION-MECHANISMS","title":"反馈与治理竞争机制"},{"artifact_paths":["promax-dossier.md","promax-concept-atlas.md","promax-case-and-countercase.md","promax-essay.md"],"claim_ids":[],"concept_ids":["V8-CANON-CIRCLE-CANDIDATE","V8-CANON-MULTICIRCLE-JOINT-OBJECT","V8-CANON-VOCAB-CONDITION-CHANNEL-MATERIAL","V8-CANON-VOCAB-CONDITION-CHANNEL-EXPERIENTIAL-MEANING","V8-CANON-VOCAB-CLOCK-INTERACTION","V8-CANON-CROSS-CIRCLE-CASCADE-MEANING"],"counterexample_ids":["CASE-WEAK-FAILURE"],"example_ids":["CASE-WEAK-YANG","CASE-WEAK-COLOCATION"],"judgment_ids":[],"section_id":"SECTION-MULTICIRCLE","title":"多圈层、双通道与互动时钟"},{"artifact_paths":["promax-dossier.md","promax-concept-atlas.md","promax-case-and-countercase.md","promax-essay.md"],"claim_ids":[],"concept_ids":["V8-CANON-BRANCHING-PATH-GRAPH"],"counterexample_ids":["CASE-POSITION-FAILURE"],"example_ids":["CASE-POSITION-NBER","CASE-POSITION-HYBRID"],"judgment_ids":[],"section_id":"SECTION-PATH","title":"分叉路径与岗位异质性"},{"artifact_paths":["promax-dossier.md","promax-concept-atlas.md","promax-essay.md"],"claim_ids":[],"concept_ids":["V8-CANON-PROTECTION-FLOOR","V8-CANON-SEL-AGT"],"counterexample_ids":[],"example_ids":[],"judgment_ids":["POSITION-LOCK","RECOMMENDATION-LOCK"],"section_id":"SECTION-RECOMMENDATION","title":"保护、主体选择与条件化建议"}],"source_snapshot_sha256":"3186805a3e46e1b16948a4e51d08e7693a8e0dd04aa6b4604e796266d649936c","unexpanded_branch_ids":[]}
