{"coverage_complete":true,"locked_at":"2026-07-23T08:56:00Z","required_artifacts":["promax-dossier.md","promax-concept-atlas.md","promax-case-and-countercase.md","promax-essay.md"],"run_id":"promax-green-v4-gpt-5-6-sol-a2-9742973771c64e89813a768c7894faa8","schema_id":"crossframe.promax.v8.output-plan","schema_version":1,"sections":[{"artifact_paths":["promax-dossier.md","promax-concept-atlas.md","promax-case-and-countercase.md","promax-essay.md"],"claim_ids":["CLAIM-A2-CENTRAL"],"concept_ids":["V8-CANON-APP-ORG","V8-CANON-C12","V8-CANON-C9","V8-CANON-D0","V8-CANON-E1","V8-CANON-E2","V8-CANON-E4","V8-CANON-G2","V8-CANON-H4","V8-CANON-N1","V8-CANON-N2","V8-CANON-N3","V8-CANON-O1","V8-CANON-O2","V8-CANON-O3","V8-CANON-O4","V8-CANON-PF-1","V8-CANON-PF-3","V8-CANON-STRONG-JUDGMENT-TEN-QUESTIONS","V8-CANON-TASK-DIAGNOSIS","V8-CANON-TASK-EXPLANATION","V8-CANON-TASK-NORMATIVE-SELECTION","V8-CANON-TOOL-CLAIM-VALIDATION","V8-CANON-TOOL-EVIDENCE-LEDGER"],"counterexample_ids":["CASE-A2-GOV-FAILURE","CASE-A2-TOPOLOGY-FAILURE","CASE-A2-AUTONOMY-FAILURE"],"example_ids":["CASE-A2-GOV-REAL","CASE-A2-GOV-CONDITIONAL","CASE-A2-TOPOLOGY-REAL","CASE-A2-TOPOLOGY-CONDITIONAL","CASE-A2-AUTONOMY-REAL","CASE-A2-AUTONOMY-CONDITIONAL"],"judgment_ids":["POSITION-LOCK","RECOMMENDATION-LOCK"],"section_id":"SECTION-A2-ANALYSIS","title":"远程办公与组织信任：边界、竞争机制、判断与有限建议"}],"source_snapshot_sha256":"3186805a3e46e1b16948a4e51d08e7693a8e0dd04aa6b4604e796266d649936c","unexpanded_branch_ids":[]}
