{"coverage_complete":true,"locked_at":"2026-07-23T09:12:00+08:00","required_artifacts":["promax-dossier.md","promax-concept-atlas.md","promax-case-and-countercase.md","promax-essay.md"],"run_id":"promax-run-dd7c57f21d368fd0","schema_id":"crossframe.promax.v8.output-plan","schema_version":1,"sections":[{"artifact_paths":["promax-dossier.md","promax-concept-atlas.md","promax-case-and-countercase.md","promax-essay.md"],"claim_ids":["CLAIM-REMOTE-TRUST-INEVITABILITY"],"concept_ids":["V8-CANON-APP-ORG","V8-CANON-CIRCLE-CANDIDATE","V8-CANON-MULTICIRCLE-JOINT-OBJECT","V8-CANON-U02","V8-CANON-U06","V8-CANON-U07","V8-CANON-C3","V8-CANON-C6","V8-CANON-BRANCHING-PATH-GRAPH","V8-CANON-FORECAST-ACTION-CEILING","V8-CANON-SEL-AGT","V8-CANON-SIMPLE-FORECAST-BASELINE"],"counterexample_ids":["CASE-M1-FAIL-1","CASE-M2-FAIL-1","CASE-M3-FAIL-1"],"example_ids":["CASE-M1-SIM-1","CASE-M1-SIM-2","CASE-M2-SIM-1","CASE-M2-SIM-2","CASE-M3-SIM-1","CASE-M3-SIM-2"],"judgment_ids":["POSITION-LOCK","RECOMMENDATION-LOCK"],"section_id":"SECTION-CONCEPTS","title":"跨尺度多圈层概念与对象边界"}],"source_snapshot_sha256":"3186805a3e46e1b16948a4e51d08e7693a8e0dd04aa6b4604e796266d649936c","unexpanded_branch_ids":[]}
